{
  "$schema": "../schema/vector-file.schema.json",
  "suite": "fingerprint",
  "version": 1,
  "generator": {
    "tool": "python (hashlib, cryptography 50.0.2, coincurve 21.0.0, pycryptodome 3.23.0)",
    "version": "cpython 3.12.13",
    "script": "tools/vectors/generate_fingerprint.py"
  },
  "cases": [
    {
      "id": "owner-a",
      "source": "04 \u00a72.9 fingerprints: owner fingerprint over ownerEvm, ownerNostr and ownerEnc",
      "input": {
        "op": "ownerFingerprint",
        "ownerEvm": "0x697fd2bdc55e958f691b55866c8dfa4ce4647afc",
        "ownerNostr": "0x0ff90544f8f613aae3e42a3993eddadc5111aea279c7a9bd3f8ff846781bfa52",
        "ownerEnc": "0x4fecb0752fb38a3084a09412cf6f00012c0a73893fecccf1e85ced9583415871"
      },
      "expected": {
        "digest": "13afa1dc553e422f02164e31ce2940f0343390abd886c054d7be8096619f4e4b",
        "short": "13AF\u00b7A1DC",
        "long": "13AFA1DC553E422F02164E31CE2940F0343390ABD886C054D7BE8096619F4E4B",
        "domainClaimFp": "13afa1dc553e422f02164e31ce2940f0343390abd886c054d7be8096619f4e4b"
      }
    },
    {
      "id": "owner-b",
      "source": "04 \u00a72.9 fingerprints: owner fingerprint over ownerEvm, ownerNostr and ownerEnc",
      "input": {
        "op": "ownerFingerprint",
        "ownerEvm": "0x456181b43cb8839e4beb29f3d56ce58aef61d8a9",
        "ownerNostr": "0x5dfa3cf198f2c225ffee1daa5b4202ee5e2b6b62a0730463d6ee9129acb94479",
        "ownerEnc": "0xa4b5906f09d7bc80d4d4d09524e587f07d8e82442528d99dc764db97c262266b"
      },
      "expected": {
        "digest": "a6d2226d60723ffec74625122e003fbea6fd39dde188ebf9271fcefd1a0d34fa",
        "short": "A6D2\u00b7226D",
        "long": "A6D2226D60723FFEC74625122E003FBEA6FD39DDE188EBF9271FCEFD1A0D34FA",
        "domainClaimFp": "a6d2226d60723ffec74625122e003fbea6fd39dde188ebf9271fcefd1a0d34fa"
      }
    },
    {
      "id": "owner-copied-owner-nostr",
      "source": "04 \u00a72.9 fingerprints: another owner's ownerNostr with this owner's ownerEvm gives a different fingerprint",
      "input": {
        "op": "ownerFingerprint",
        "ownerEvm": "0x456181b43cb8839e4beb29f3d56ce58aef61d8a9",
        "ownerNostr": "0x0ff90544f8f613aae3e42a3993eddadc5111aea279c7a9bd3f8ff846781bfa52",
        "ownerEnc": "0xa4b5906f09d7bc80d4d4d09524e587f07d8e82442528d99dc764db97c262266b"
      },
      "expected": {
        "digest": "7ee847062a6c463634b59eb3735f688b382dc9f0d7122d62a42a9956f010f4b6",
        "short": "7EE8\u00b74706",
        "long": "7EE847062A6C463634B59EB3735F688B382DC9F0D7122D62A42A9956F010F4B6",
        "domainClaimFp": "7ee847062a6c463634b59eb3735f688b382dc9f0d7122d62a42a9956f010f4b6"
      }
    },
    {
      "id": "agent-a",
      "source": "04 \u00a72.9 fingerprints: agent fingerprint over the raw 20-byte agent ID",
      "input": {
        "op": "agentFingerprint",
        "agentId": "0x6570c98c156b367a207f1589a4400ea5ba50e67a"
      },
      "expected": {
        "digest": "92c5f7a436d4da1e56ede76fab20b70fd1896f43957fa867b8dd72ba27c55bc9",
        "short": "92C5\u00b7F7A4",
        "long": "92C5F7A436D4DA1E56EDE76FAB20B70FD1896F43957FA867B8DD72BA27C55BC9",
        "domainClaimFp": "92c5f7a436d4da1e56ede76fab20b70fd1896f43957fa867b8dd72ba27c55bc9"
      }
    },
    {
      "id": "agent-b",
      "source": "04 \u00a72.9 fingerprints: agent fingerprint over the raw 20-byte agent ID",
      "input": {
        "op": "agentFingerprint",
        "agentId": "0xfa1ec50c9f82ab67fd6614a5585ba2538fbd0aa7"
      },
      "expected": {
        "digest": "95e57eaec2a55b4071138c9ed93f3681feb067f2f4dc5cc241d14391eb8a68df",
        "short": "95E5\u00b77EAE",
        "long": "95E57EAEC2A55B4071138C9ED93F3681FEB067F2F4DC5CC241D14391EB8A68DF",
        "domainClaimFp": "95e57eaec2a55b4071138c9ed93f3681feb067f2f4dc5cc241d14391eb8a68df"
      }
    }
  ]
}
